date_added,business_name,website,niche,location,source,why_watch,recommended_offer,status,notes
2026-06-23,Takarító Kommandó,https://www.takaritokommando.hu,Commercial cleaning,Budapest,Async research addendum,Commercial cleaning backup lane candidate,48-Hour Lead Leak Review,Watchlist,Do not outreach before property-services first 5 reviews.
2026-06-23,A Takarítók,https://atakaritok.hu,Commercial cleaning,Budapest,Async research addendum,Commercial cleaning backup lane candidate,48-Hour Lead Leak Review,Watchlist,Do not outreach before property-services first 5 reviews.
2026-06-23,Professional Office Cleaning Hungary,https://office-cleaning.hu/office-cleaning-services,Commercial cleaning,Budapest,Async research addendum,Strong benchmark with 24h/48h quote promise,48-Hour Lead Leak Review,Benchmark,Use as proof that speed matters in this lane.
2026-06-23,R-SEC Security,https://rsec.hu/biztonsagi-szolgalat-budapest/,Security services,Budapest,Async research addendum,Security watchlist candidate,48-Hour Lead Leak Review,Watchlist,Regulated/trust-heavy lane. Use after proof.
2026-06-23,Árgus Security,https://argus-security.hu,Security services,Budapest/Hungary,Async research addendum,Security watchlist candidate,48-Hour Lead Leak Review,Watchlist,Verify manually before any outreach.
2026-06-23,Premier Property Management,https://premierpropertymanagement.hu,Property management,Budapest,Async research addendum,Additional primary-lane candidate,48-Hour Lead Leak Review,Research,Use after first 5 property-service reviews if needed.
2026-06-23,Interház,https://interhaz.hu/en/,Property management,Budapest,Async research addendum,Additional primary-lane candidate,48-Hour Lead Leak Review,Research,Use after first 5 property-service reviews if needed.
